{"schema_version":"1.0.0","protocol_version":"1.0.0","file":"sample_import_conflict.js","encoding":"utf-8","hunks":[{"id":"hunk_1","type":"conflict","base_range":{"start":0,"end":1},"ours_range":{"start":0,"end":1},"theirs_range":{"start":0,"end":1},"base_lines":["import { a } from \"pkg\";"],"ours_lines":["import { a, b } from \"pkg\";"],"theirs_lines":["import { a, c } from \"pkg\";"],"is_conflict":true,"metadata":{"symbol":""}}],"graph":{"nodes":[{"node_id":"node_1","hunk_id":"hunk_1","category":"conflict","depends_on":[]}],"edges":[]},"analysis_required":true,"meta":{"engine_version":"0.1.0","generated_at":"2026-02-23T20:30:31Z"}}